{
  "name": "example-grok",
  "provider": "grok",
  "timeout_s": 600,
  "timeout_min": 1,
  "timeout_max": 1800,
  "models": {
    "allow": [
      "grok/grok-4.5"
    ],
    "deny": []
  },
  "roles": {
    "scout": {
      "model": "grok/grok-4.5",
      "mode": "readonly"
    },
    "review": {
      "model": "grok/grok-4.5",
      "mode": "readonly"
    },
    "implement": {
      "model": "grok/grok-4.5",
      "mode": "bounded-write"
    }
  },
  "review": {
    "required_after_write": true,
    "independence": {
      "different_job": "required",
      "different_model": "required",
      "different_family": "preferred",
      "different_provider": "optional"
    }
  },
  "worktree": {
    "require_linked_worktree_for_write": true,
    "require_lease_for_write": true,
    "allow_primary_for_readonly": true
  },
  "write_enabled": false,
  "commands": {}
}
