{
  "name": "example",
  "provider": "opencode",
  "timeout_s": 600,
  "timeout_min": 1,
  "timeout_max": 1800,
  "models": {
    "allow": [
      "opencode-go/qwen3.8-max",
      "opencode-go/glm-5.3",
      "opencode-go/kimi-k3",
      "opencode-go/deepseek-v4-pro",
      "opencode-go/deepseek-v4-flash"
    ],
    "deny": [
      "openai/*",
      "opencode-go/gpt-5.6-luna",
      "opencode-go/grok-4.5"
    ]
  },
  "roles": {
    "scout": { "model": "opencode-go/deepseek-v4-flash", "mode": "readonly" },
    "review": { "model": "opencode-go/deepseek-v4-pro", "mode": "readonly" },
    "implement": { "model": "opencode-go/glm-5.3", "mode": "bounded-write" }
  },
  "review": {
    "required_after_write": true,
    "independence": {
      "different_job": "required",
      "different_model": "required",
      "different_family": "preferred",
      "different_provider": "optional"
    }
  },
  "worktree": {
    "require_linked_worktree_for_write": true,
    "require_lease_for_write": true,
    "allow_primary_for_readonly": true
  },
  "write_enabled": false,
  "commands": {}
}
